{
  "api_version": "worker-celld.agentic-sandbox/v1",
  "name": "agentic-instance-cell",
  "version": "1.0.0",
  "entrypoint": "worker.mjs",
  "digest": "sha256:9057aa0debb402c9f8177d1df0c8c06de487c266029f0c5282a8e1cd1076322b",
  "capabilities": [
    "worker.fetch",
    "worker.rpc",
    "durable.storage",
    "durable.alarm",
    "websocket.inbound",
    "network.outbound.fetch",
    "wasm.module",
    "assets.static"
  ],
  "outbound_http": {
    "allowed_origins": ["service:MANAGEMENT", "http://127.0.0.1:8125"]
  },
  "limits": {
    "cpu_ms_per_request": 50,
    "memory_mb": 128,
    "requests_per_minute": 600,
    "storage_mb": 64,
    "resident_cells": 1000
  },
  "tenancy": {
    "trust_domain": "agentic-sandbox.internal",
    "hostile_multi_tenant": false
  },
  "compatibility": {
    "celld_version": "v0.2.1",
    "compatibility_date": "2026-08-14"
  }
}
